name,email,phone_number,date_of_birth,address,city,state,zipcode,neighborhood,preferred_contact_method,notes,client_type
Harper Taylor,harper.taylor@example.com,001-736-728-5017x7121,1953-12-22,638 Park Ave,New York,NY,67400-3686,Brooklyn,Email,View television tree seven more executive.,Non-Profit
Melissa Morris,melissa.morris@example.com,(747)938-2438x9750,2003-06-30,814 Northern Blvd,New York,NY,31043-3221,Queens,Email,"There that with ground. Various score human travel card her.
Dream evening do know for pretty. Past near those government. Increase under free possible.",Individual
Jonathan Simmons,jonathan.simmons@example.com,488-366-2031x916,1970-03-28,9459 Bleecker Street,New York,NY,91286-1105,Staten Island,Phone,"Huge exactly leg sea crime great bar fund. According Mrs down teacher. Number event her difficult wait.
Culture ago president culture word item speak. Call common common realize.",VIP
David Garcia,david.garcia@example.com,383-913-8329,1977-11-04,10479 Richmond Ave,New York,NY,40506-9569,Manhattan,Email,Today firm final reduce center. Upon section network analysis mission five future. Shoulder probably which forget article industry.,Government
Heather Bailey,heather.bailey@example.com,333.794.9326x501,1956-06-14,42344 Steinway Street,New York,NY,74323-6675,Queens,Mail,"Center various soon call. Animal point today soon.
Various stand somebody lot them commercial actually. Once policy old north authority. Operation item interview truth table today.",Small Business
Zoey Miller,zoey.miller@example.com,(954)345-0349,1943-10-20,16301 Park Ave,New York,NY,48492-6810,Bronx,Phone,"Area he theory even list say. Authority concern have spring yet.
Agent artist feel law dark some or later. National church particularly rise.",Government
Chloe Jenkins,chloe.jenkins@example.com,(608)633-0980,1987-01-05,38549 Canal Street,New York,NY,14629-8494,Bronx,Mail,"Single medical only huge character. Compare into hospital audience.
Prepare service happen anyone eat at recent. Nice natural hour thousand all indeed once.",Small Business
Jane Gray,jane.gray@example.com,(653)974-9928,1994-12-27,1512 Columbus Ave,New York,NY,41046-4903,Brooklyn,Phone,"Marriage event financial. Always use discuss prepare friend picture event that.
Entire moment contain should window live. Place minute toward position drive.",Small Business
Lillian Rivera,lillian.rivera@example.com,572-599-6849x6312,1965-01-19,435 4th Ave,New York,NY,70557-5235,Bronx,Email,Every something beat behind doctor plan. Cold center lay late carry opportunity. Purpose next factor yard present analysis not.,Non-Profit
Nicholas James,nicholas.james@example.com,811-925-7059,1996-11-08,60968 Houston Street,New York,NY,36422-1979,Queens,Mail,News history world population third story. Reduce hour commercial well author program. Night bank decade lose at military value hit.,Non-Profit
Daniel Morris,daniel.morris@example.com,+1-419-988-3290,1952-11-04,65647 Mulberry Street,New York,NY,50068-1101,Staten Island,Phone,"Audience candidate simply instead. Theory throw decision maintain movie street simply.
Show behavior return industry debate development list. Ball begin movie more degree measure.",Small Business
Megan Wright,megan.wright@example.com,9225136843,1979-11-28,08903 Park Ave,New York,NY,56263-2572,Manhattan,Email,"Fast research understand difference wait. Whom admit history nice. Modern moment wind kitchen plan question open key.
Notice benefit contain. Ago data choice travel theory eye face.",Small Business
Aria Reed,aria.reed@example.com,268.674.6469,1966-01-15,24872 Richmond Ave,New York,NY,98203-6922,Brooklyn,Email,Top head deep business buy before trade. To walk stage special. Work system start agency pressure well course.,Small Business
James Brooks,james.brooks@example.com,327-486-2884,1955-06-22,91571 Northern Blvd,New York,NY,59347-1269,Brooklyn,Mail,"Seven around marriage from finally whatever. National worry two life mother buy. Nation political voice.
Themselves international town difference bit get include.",VIP
Nathan Long,nathan.long@example.com,801-738-3042,1980-04-13,9672 Canal Street,New York,NY,86311-4113,Brooklyn,Mail,"Rather thought free range easy participant century. Mind kid into game woman between give.
National difference eat today. Foreign different artist show hospital.",Non-Profit
Grace White,grace.white@example.com,(834)983-9530,1971-08-26,5669 Fordham Road,New York,NY,31193-6734,Bronx,Phone,"Meet next popular he race billion though ten. During pass whole. Even hold hospital station center believe talk.
Night article run market. Hour control head hear back.",Non-Profit
Charles Stewart,charles.stewart@example.com,218-802-2730x980,1990-01-04,204 Lexington Ave,New York,NY,98103-3492,Manhattan,Email,"Beat food nothing chance. Yes yard play pass.
Blue race option need treat rather. Little dream drive professor way four.",Individual
Lauren Ward,lauren.ward@example.com,001-707-809-5681x27737,1972-05-23,634 West End Ave,New York,NY,91515-7506,Bronx,Mail,"Sit alone size give possible it.
Night investment company house phone interview. Message mother social imagine. End federal Mrs everybody.",VIP
Laura Jones,laura.jones@example.com,+1-867-748-5254,1972-10-26,79387 3rd Ave,New York,NY,25454-4653,Bronx,Email,Family outside just really program. Skill nation law opportunity. Box lead if energy idea house community.,Government
Lily Flores,lily.flores@example.com,001-904-910-6246x451,2002-10-18,274 Queens Blvd,New York,NY,83473-7995,Staten Island,Mail,"Organization hold character three according before should. Skin board character cover. Bit amount factor. Office yard friend also hand.
Arm strategy real class physical.",Corporate
Steven Cook,steven.cook@example.com,521.295.2117x1751,1976-08-04,57378 5th Ave,New York,NY,75014-1878,Staten Island,Mail,"Western stop prove design. Study movie edge community fill. Town increase question trade deep example.
President ask can bank measure. Time few four drug paper radio describe. Himself upon factor.",VIP
Megan Taylor,megan.taylor@example.com,+1-808-846-8750,1968-11-10,3939 Queens Blvd,New York,NY,66775-5633,Queens,Email,"Appear high provide message. Join inside north year not man though beyond.
Ask source foreign cut culture. Her also involve people kind seek. Case senior south scene.",Government
Alexander Allen,alexander.allen@example.com,+1-561-484-5376,2000-02-13,739 Columbus Ave,New York,NY,66434-8214,Brooklyn,Email,"Court particular away paper mother blue drug. Home nation city accept law provide. Table weight certain nice sure.
Entire worker soon occur special most. Parent to may stock state on.",Corporate
Mason Clark,mason.clark@example.com,471.484.6934,1974-07-22,60344 Grand Concourse,New York,NY,71893-5865,Queens,Phone,"Month born around could. Bag set listen require be.
Bad price race dark tend chance find interview. Across them why price security case human. Total most term cup top investment large.",Non-Profit
Charles Young,charles.young@example.com,536-218-7764,1945-06-08,26561 4th Ave,New York,NY,29019-9574,Bronx,Email,Only window page often floor cup resource. Glass believe recently firm. Wrong above hope account modern man measure learn.,Small Business
Charles Jackson,charles.jackson@example.com,429.887.8774,2006-07-21,6884 West End Ave,New York,NY,58007-9697,Queens,Phone,"Third wait member heart. School himself really. Grow someone food.
Together attorney least road opportunity north back.",Non-Profit
Timothy Campbell,timothy.campbell@example.com,+1-741-528-5687x70304,1988-10-27,54211 Forest Ave,New York,NY,83517-7301,Manhattan,Email,Likely course group develop lot way. Say top idea level middle. Surface dog decade poor early skill prepare.,Government
Victoria Long,victoria.long@example.com,547.463.2213x253,1945-07-25,964 Bleecker Street,New York,NY,91841-3207,Brooklyn,Email,Region dream agreement third research. Course sport you store as. Production yeah argue.,Small Business
Jacob Henderson,jacob.henderson@example.com,241.925.2750,1991-08-17,96243 Roosevelt Ave,New York,NY,99605-1223,Staten Island,Email,"Situation bed network medical discussion. Throw president only edge control who team. More various because grow walk.
Prevent provide option support.",Small Business
Nathan Coleman,nathan.coleman@example.com,+1-740-376-6853x79665,1975-11-08,4920 Mulberry Street,New York,NY,62835-5966,Staten Island,Phone,"Major never election increase onto have mission. Employee number care ahead. List run listen top law owner.
Author fire send consider pay whether. Fish make too between.",Small Business
Aria Jones,aria.jones@example.com,+1-347-961-9619,1995-02-22,90296 Madison Ave,New York,NY,28407-5358,Brooklyn,Email,Opportunity offer idea his director former little. Suffer even alone specific perform personal. Tv environment wide.,Non-Profit
Emma Coleman,emma.coleman@example.com,785-945-6432,1987-05-29,18207 Richmond Ave,New York,NY,85370-3341,Staten Island,Phone,"Find book dark group cultural local building. Again cause learn enter writer stock out. Best lead report religious create crime.
Hope measure now require beyond. In training seat.",VIP
Jason Davis,jason.davis@example.com,829.444.0031x857,1958-02-09,3128 Canal Street,New York,NY,83193-3839,Queens,Mail,"Image foot call environmental big computer. Word such instead computer opportunity. Share hundred probably court.
School win sound case scene firm.",Non-Profit
Michelle Cooper,michelle.cooper@example.com,(726)603-5695,1963-01-05,0903 Hylan Blvd,New York,NY,12764-9480,Manhattan,Email,"Change according those life pull sister.
Drop morning drug feeling act task. Work late store appear city serious choice.
Carry create must run trial reflect.",Corporate
Madison Rodriguez,madison.rodriguez@example.com,+1-617-908-4607,1962-08-08,29363 Central Park West,New York,NY,55511-1158,Staten Island,Mail,"Whom house no bring company improve arrive. Kind second education public.
Draw middle sing sometimes would into after. Expect former adult former.
Authority tough military artist information product.",Non-Profit
Samuel Patterson,samuel.patterson@example.com,(949)698-0988,1956-04-10,0607 Roosevelt Ave,New York,NY,69818-6863,Bronx,Email,"Teacher gun answer.
Teach nor debate rock reality role sometimes. Offer power develop buy better agent. Of first ability to speech similar. Take attack card law.",Government
Grace Carter,grace.carter@example.com,258.947.1732x573,1970-05-04,8698 3rd Ave,New York,NY,43415-3915,Manhattan,Mail,Picture place others director tell hear role. Forget have degree can away tend seven another. Role word writer practice practice.,Small Business
Laura Barnes,laura.barnes@example.com,001-764-906-5723,1945-09-16,9767 West End Ave,New York,NY,69802-4692,Brooklyn,Phone,Contain system foot however economic paper others. Music same record various remember get. Something late put way thousand Republican.,Non-Profit
Harper Parker,harper.parker@example.com,(858)373-6857,2006-05-30,915 Madison Ave,New York,NY,35064-4784,Staten Island,Mail,Skill term message spring happen society skin establish. Simply several long treat easy car agree. Different yet century different find itself affect.,Small Business
Isaac Lopez,isaac.lopez@example.com,8442170942,1980-05-07,549 Bowery,New York,NY,73569-3486,Bronx,Mail,Energy yet every service will. Water big onto page under. Loss must this area cost moment.,Corporate
Joshua Rivera,joshua.rivera@example.com,504.868.5162,1983-08-09,20192 Steinway Street,New York,NY,21242-9915,Manhattan,Email,"Section social experience possible begin. Pretty generation win. Expect short religious now.
Sort know ago his reflect baby memory. Someone within piece by send.",Non-Profit
Ethan Rogers,ethan.rogers@example.com,638.310.5167x84713,2006-06-10,7577 Columbus Ave,New York,NY,55664-1148,Brooklyn,Phone,"Per life a. Reduce may civil training.
Building food realize most color its fire. Agent me test this form somebody heart method.",VIP
Chris Martin,chris.martin@example.com,780.796.1840x293,1944-12-16,65858 Wall Street,New York,NY,89553-9959,Queens,Mail,"President rise strategy other eight first. Practice executive change eat decide bad use tax. Beat fear stay still in.
Trouble team eight say. Daughter street manager debate bank myself series.",Small Business
Joseph Cook,joseph.cook@example.com,001-876-396-9561x40819,1954-08-29,778 Bowery,New York,NY,87648-9455,Manhattan,Email,"Plant character whether air difference. Out decide threat. Maintain beat yard hope along. Interest month reality.
Event true ever both add vote bit sell.",Small Business
Rebecca Phillips,rebecca.phillips@example.com,001-448-789-1575x855,1999-10-12,88643 Northern Blvd,New York,NY,45602-6555,Brooklyn,Mail,"Prove onto future lay sometimes. Onto any support why policy. Significant name crime back manage across produce. Religious campaign I.
Magazine rate recognize. Yes finish research throw deep.",Non-Profit
Joseph Morris,joseph.morris@example.com,(553)751-3238,1990-12-11,97067 Queens Blvd,New York,NY,78918-7291,Queens,Mail,"Our per think still describe. Window main own deep effect information know.
Little white future significant Democrat continue message choice. Take piece smile skill me.",Government
Aurora Scott,aurora.scott@example.com,945-430-8308x4869,1950-03-12,6507 Lexington Ave,New York,NY,31365-1891,Bronx,Phone,"Board cold paper capital how mean ten.
Wind book environmental who candidate reduce learn beautiful. Country member along. Instead step question evening skill note.",Individual
Steven Anderson,steven.anderson@example.com,813.467.8782x250,1999-05-18,17325 2nd Ave,New York,NY,24318-8413,Bronx,Email,"Official candidate stuff hour end near. Certain interesting buy compare often. High everything leader stop most our.
Agree prevent single thousand conference dinner. Receive successful voice.",Non-Profit
Layla Mitchell,layla.mitchell@example.com,001-762-306-6654,1995-02-07,1812 Central Park West,New York,NY,38388-5199,Manhattan,Email,Run social end defense with remain. Recently itself operation anyone answer spend billion. Board husband appear address enjoy show.,Corporate
Samantha Williams,samantha.williams@example.com,717.442.2605,1969-10-29,88416 Fulton Street,New York,NY,47923-7250,Bronx,Phone,"Write wall PM institution why issue. Walk near production.
Effect statement behavior development body recent thank per. And prove whole center since summer majority whom.",Government
Aria Richardson,aria.richardson@example.com,(263)328-8291x24546,1964-09-28,156 Victory Blvd,New York,NY,75819-3258,Bronx,Mail,Some court plant record nothing value. Realize pattern sell go organization. Probably discuss week picture condition.,VIP
Michael Cooper,michael.cooper@example.com,(616)605-8517,1998-07-28,7144 Fulton Street,New York,NY,97365-2831,Manhattan,Phone,Wait technology low where argue authority. Pm line attack at. Close else grow artist.,Non-Profit
Heather Hill,heather.hill@example.com,555.364.8146x3499,1952-05-20,6044 Bleecker Street,New York,NY,43087-3519,Queens,Email,Understand southern continue face yes break fine consider. Away step wonder rest positive rich election. View behind mouth indeed.,Non-Profit
Grace Walker,grace.walker@example.com,+1-543-509-7102x1774,1996-01-12,6425 West End Ave,New York,NY,67099-8677,Brooklyn,Email,"Focus hotel some assume until maybe. Stuff thousand fight simply hot after role. Experience life tend choose.
Field support tend paper. Listen tough detail trip. From support just once place ask.",Non-Profit
James Griffin,james.griffin@example.com,450-276-3289x73601,1990-09-07,9968 Northern Blvd,New York,NY,17793-7850,Staten Island,Mail,"Represent me top rise table cell report again. Remember rather money garden how music. Firm weight different left in teacher less.
System should that. Night scene argue.",VIP
Adam Cooper,adam.cooper@example.com,956.317.1172x692,1964-05-12,703 Northern Blvd,New York,NY,32696-4049,Manhattan,Mail,"Message drive large give evidence. Probably decide suggest Congress language.
None better read check source arm social. Its style measure fish for.",Corporate
James Scott,james.scott@example.com,884-210-3768,1990-09-24,5713 Grand Concourse,New York,NY,29177-3094,Staten Island,Phone,"Girl wide receive thus sing study never. Western police their. Game enjoy long grow member fight.
Everybody result fly difference election. Produce itself for somebody far.",Government
Heather Evans,heather.evans@example.com,001-543-670-1998x800,1949-12-23,97277 3rd Ave,New York,NY,40691-6459,Queens,Phone,Popular manage activity modern individual future state region. Mouth soon economic degree under crime. Radio purpose visit.,Non-Profit
Paisley Flores,paisley.flores@example.com,446-661-4867,1991-03-31,0457 Forest Ave,New York,NY,92833-6098,Bronx,Email,Prepare someone threat carry then. Investment statement mind his top member group. Could technology various because its feel ten situation.,Individual
Gabriel Barnes,gabriel.barnes@example.com,001-804-996-6747x3147,1972-02-04,770 Roosevelt Ave,New York,NY,22225-4219,Brooklyn,Email,"Once leave television behavior red four drug. Father agent ball.
Believe rule color agency. Trip yard say ready. Agent threat family around. Beautiful ten level network any.",Corporate
Crystal Taylor,crystal.taylor@example.com,001-657-549-2207x0610,1968-11-07,67077 Hylan Blvd,New York,NY,35377-7728,Staten Island,Email,"Color power same enough compare. Nation join international position room. Girl blood wear federal allow positive.
Recent join girl nor do.
Public black leave write.",Individual
Olivia Morris,olivia.morris@example.com,705.274.5240,1967-07-01,1648 1st Ave,New York,NY,92013-8846,Bronx,Mail,"Bar scene material also letter. Cup describe thing player relationship risk.
Somebody in protect already person full. Free soon world treat quite. Daughter lawyer fund turn likely look.",Individual
Jessica Allen,jessica.allen@example.com,+1-642-509-8189,1989-12-27,887 Fordham Road,New York,NY,78396-3405,Queens,Mail,"Magazine indicate almost. Hand occur statement.
Rather street probably guy sign billion pay.
Improve mind foot out century. Water financial rule station be media.",Corporate
Jason Jenkins,jason.jenkins@example.com,346.821.5704,2003-07-01,9789 4th Ave,New York,NY,23962-3595,Bronx,Email,"Figure bill man school. Reality vote role add expect me.
Others suffer often food from take. Interest visit open field beyond leave.",Small Business
Sarah Sanchez,sarah.sanchez@example.com,(389)576-8744x15593,1963-11-14,80687 Fordham Road,New York,NY,86828-4900,Manhattan,Mail,Event which voice keep of set. Card example life our Democrat. Find indeed world.,Small Business
Laura Henderson,laura.henderson@example.com,001-694-399-8958x36415,1973-12-26,38713 Broadway,New York,NY,88917-5827,Manhattan,Email,"Chair subject sister door left according attorney my. Third fact for sound foreign wear.
Notice when ago research style. Can heart near sense skill. Out tonight throughout something guy accept focus.",Individual
Lily Hernandez,lily.hernandez@example.com,594-368-3996x27514,1943-09-02,482 Central Park West,New York,NY,62806-6142,Manhattan,Mail,Decade away structure be movement toward whole area. Nation age final role someone wrong total. Year about break stop.,Non-Profit
Chloe Harris,chloe.harris@example.com,001-350-855-3937x48439,2001-07-10,22838 Grand Concourse,New York,NY,52074-6022,Queens,Mail,"Compare treat agency project human run money. Call finish on together home deal laugh different.
Feel mention less prove. Ball oil way three operation.",Government
Logan Ward,logan.ward@example.com,451-991-4754x7774,1985-05-04,441 1st Ave,New York,NY,49848-7176,Staten Island,Email,Sister writer against son provide. Baby shoulder certain.,Individual
Jessica Perez,jessica.perez@example.com,329-424-2119,1992-09-18,568 Northern Blvd,New York,NY,52016-8545,Staten Island,Mail,Growth structure bit energy pattern along high. Enjoy still thank level read yes. Make just yes option pressure catch kid turn. Type there manager recently.,Individual
Amber Clark,amber.clark@example.com,768-549-1101,1982-04-11,18369 West End Ave,New York,NY,39419-1158,Bronx,Email,Political charge ten grow magazine. Cultural behavior scientist senior create analysis admit.,Government
Nicholas Henderson,nicholas.henderson@example.com,786.236.1703x26431,1991-02-01,28546 3rd Ave,New York,NY,98841-1104,Brooklyn,Mail,"Fight road least lawyer. As happy blue impact time hotel. Bad unit all form medical. Hit key good table.
Hear few church trouble tell. Outside drug let.
Thing any seven born.",Government
Jason Reed,jason.reed@example.com,+1-931-431-2123x9666,1969-08-27,409 Grand Concourse,New York,NY,98038-7667,Brooklyn,Phone,"Place century member dog project far. Cup rise report hair.
Western job nor. Book mother country travel book upon spring wind.",Non-Profit
Evan Miller,evan.miller@example.com,799-431-2964x252,1957-09-02,76937 Fulton Street,New York,NY,66078-3525,Brooklyn,Phone,"I list fill during air. Like stock game bag he win law. Morning better mission southern read paper policy.
Debate break hand cold. Hear consumer window positive education per occur.",VIP
Jason Green,jason.green@example.com,555.892.0923x5736,2003-12-24,493 Steinway Street,New York,NY,66193-7414,Queens,Mail,Adult as open relate always. Know figure red father. Page condition prove.,VIP
Heather Bell,heather.bell@example.com,584.791.4995x94671,1955-02-26,2046 Columbus Ave,New York,NY,77437-3847,Bronx,Phone,Particular at glass site daughter never. Quality second care color occur. Top under how own prepare value.,Corporate
Hannah Ward,hannah.ward@example.com,(824)530-4905,1946-11-24,007 West End Ave,New York,NY,29061-7672,Queens,Email,"Support decide race force. Leave suggest natural institution treat generation.
Develop left action politics important allow.
Tend any car. Skin likely rate in meet. Anything process dark put.",Individual
Isaac Reed,isaac.reed@example.com,001-999-678-0069x9853,1981-09-15,269 Bleecker Street,New York,NY,56861-5516,Queens,Phone,"Now these town large financial history happen. By director other item what which charge.
Concern claim certain side. Perhaps character general along such. Each view authority quickly real find right.",Corporate
Crystal Howard,crystal.howard@example.com,(602)838-3838x9906,1997-02-08,1919 Grand Concourse,New York,NY,79976-6350,Manhattan,Phone,"Stuff fear low. Rest remember book ask nearly blood born.
Occur response line hour success. Question probably book million. Assume from type nation authority music.",Small Business
Cameron Jenkins,cameron.jenkins@example.com,715-620-4022x914,1978-06-22,243 4th Ave,New York,NY,20814-4730,Brooklyn,Phone,"Reality right attention medical. Learn on again stock. Ok although send partner peace chair foot.
Reduce sister government education on. So since indeed program scene book. Speech upon very visit.",Corporate
Charles Thompson,charles.thompson@example.com,525-760-1548,1977-08-01,753 Arthur Ave,New York,NY,92896-8133,Manhattan,Phone,"Argue agency team. Book then show walk.
Yard head picture build notice. Machine style modern. Force cultural theory half.",Non-Profit
Crystal Bennett,crystal.bennett@example.com,718.422.8523,1980-09-28,31963 3rd Ave,New York,NY,12181-5754,Bronx,Mail,Interview stand light war experience sister. Star note us paper movement. Organization fast control free.,Non-Profit
Patrick Mitchell,patrick.mitchell@example.com,(354)418-9012x1433,1999-03-30,9308 Hylan Blvd,New York,NY,41193-3748,Queens,Email,Suggest commercial receive black able information. Pick manage space get capital happen. Much agent member must should.,Government
Olivia Green,olivia.green@example.com,(882)318-6224,1999-09-18,92237 Amsterdam Ave,New York,NY,53762-2830,Staten Island,Mail,"Trip think must. Meet southern visit next first writer. Order during office low civil suffer couple.
Issue general though detail building fine whatever me. Away shoulder professor administration.",Government
Patrick Hayes,patrick.hayes@example.com,(778)780-4690x80440,1982-03-20,746 1st Ave,New York,NY,60167-7685,Queens,Phone,"Style mouth include senior. Talk job cause understand material herself. Cause page thing property shake drug around.
Three exactly end watch. Indicate trial some else director kind.",VIP
Chris Perez,chris.perez@example.com,+1-223-205-2247x06755,1946-03-28,42711 Forest Ave,New York,NY,15782-7009,Queens,Mail,"Should window kitchen three. You later by. Character western development move. Safe high major family.
Point pressure before respond property.",Non-Profit
Brandon Torres,brandon.torres@example.com,+1-289-650-7547x029,1977-11-27,39222 West End Ave,New York,NY,42622-4366,Brooklyn,Mail,"Quality you suggest. School but professional property start thing.
Rich term consider. Provide old question. Prevent see interest difficult.
Maintain able sure power culture sign.",VIP
Emily Wilson,emily.wilson@example.com,813.454.4280,1964-02-24,98542 Steinway Street,New York,NY,58448-2292,Staten Island,Email,Fight prevent boy full upon. Sell network sing whether provide. Bag large color. Huge simple college listen western them religious.,VIP
Joseph Evans,joseph.evans@example.com,536.235.3186x5616,2006-01-28,9611 Canal Street,New York,NY,68034-1582,Brooklyn,Mail,Lot long pattern food newspaper case. Even together soldier around usually power save next. Life space year white American and.,Individual
Laura Wilson,laura.wilson@example.com,748-414-7367,1987-10-21,293 Broadway,New York,NY,67023-9119,Brooklyn,Email,Stop clearly science within exactly wide animal. A college involve customer offer live nor foot. Run phone purpose after wall.,Corporate
Laura Howard,laura.howard@example.com,410.759.0584x7484,1966-01-22,8861 5th Ave,New York,NY,17398-7816,Staten Island,Email,"True as agency anyone. Here experience accept method. Give work chance cover admit involve political skill.
Thank past pressure treatment themselves need eat research. Wear minute hit society per.",VIP
