name,email,phone_number,date_of_birth,address,city,state,zipcode,neighborhood,preferred_contact_method,notes,client_type
Nathan Morris,nathan.morris@example.com,(778)795-2600x5462,1998-12-08,3552 4th Ave,New York,NY,72789-9812,Staten Island,Email,Wife least child by brother tree seem. Last low could something investment. Eight week pattern today.,Individual
Ellie Gray,ellie.gray@example.com,+1-325-558-8909x02957,1965-02-15,369 Astoria Blvd,New York,NY,30430-4088,Queens,Phone,"Clearly bit popular service yourself. Such might question would quality. Mention data true business.
Sister seven truth budget campaign stay later. Arrive stay social upon.",Corporate
Heather Ramirez,heather.ramirez@example.com,001-287-230-6311x64287,2000-11-09,600 Queens Blvd,New York,NY,46273-5415,Manhattan,Phone,"Church state fight fight. By pattern walk decide resource manage. Million task recently discuss green.
Service social world third natural require. Old or force others share.",Government
Jason Phillips,jason.phillips@example.com,001-555-840-9794,1970-10-11,845 1st Ave,New York,NY,82935-2743,Queens,Phone,"Somebody special treatment control area serve why. Suddenly bed entire now central. Message particular hear generation interview.
Task reason six surface. True third when.",Small Business
Penelope Young,penelope.young@example.com,524.251.8214,1985-12-13,3308 Houston Street,New York,NY,87084-3475,Manhattan,Mail,Lose mention make beyond sign respond trade better. Tell page letter and certain stock expert. Civil subject issue table administration professor.,Non-Profit
Jacob Mitchell,jacob.mitchell@example.com,001-463-500-0847x6262,1983-07-01,4664 Fulton Street,New York,NY,25485-2911,Manhattan,Phone,"Can memory PM president change. Read professor thus decade however next.
Guy risk last some analysis gun. Break save option. Military room less behind.",VIP
Jack Long,jack.long@example.com,677-233-6789x2521,1978-04-07,9692 5th Ave,New York,NY,24983-4652,Staten Island,Phone,Win open Congress ground I environment sit. Why office one answer grow opportunity. With long commercial major discuss drive admit.,VIP
Addison Collins,addison.collins@example.com,001-394-306-2981x22633,1955-10-23,34422 Fulton Street,New York,NY,42513-8771,Queens,Phone,"Huge day tend new radio smile. Miss discuss might station law future.
Could computer pull necessary building. Spring business billion hold now.
Decade throughout his attorney piece.",Government
Patrick Ward,patrick.ward@example.com,5724426218,1997-04-04,26331 Fordham Road,New York,NY,77249-1839,Brooklyn,Phone,"Main professional security ground between never. Compare building condition. Fear two item tax later present too.
Manager poor staff record compare enough style.",Small Business
Grace Long,grace.long@example.com,402-550-9565x0607,2001-07-26,10994 Victory Blvd,New York,NY,56751-5893,Bronx,Email,"Nature discover rather piece fight. Run want Mr poor close like add plan.
Take girl early edge drop them. Drop executive would charge imagine opportunity.",Small Business
David Sanders,david.sanders@example.com,894-815-9340,1998-02-08,46472 Wall Street,New York,NY,17288-3970,Brooklyn,Phone,Feel hand public. Friend product laugh film. Choose service design sing experience remain.,Corporate
James Bryant,james.bryant@example.com,580-841-1120,1954-04-25,3248 Northern Blvd,New York,NY,27949-2118,Queens,Phone,Ahead professional hope early job. Method technology land source section state oil.,Government
Chris Barnes,chris.barnes@example.com,209.642.2646x726,1993-07-17,5491 Canal Street,New York,NY,44791-8351,Queens,Mail,"Score big reach rock. Personal suddenly stage black. Happy stay smile particularly action across.
Plan information impact animal try recognize dream speech. Mouth type matter teach first.",Government
Chris Green,chris.green@example.com,684-327-0129x88092,1986-11-23,501 Bowery,New York,NY,83069-5099,Bronx,Phone,"Knowledge apply sure Republican improve can.
Them do authority statement. Expect decade exist effect. Rich left spend small entire.",Non-Profit
Charlotte Diaz,charlotte.diaz@example.com,760.705.9852,1975-09-04,952 Astoria Blvd,New York,NY,28124-7226,Brooklyn,Phone,Book authority later year last natural.,Corporate
Rebecca Reed,rebecca.reed@example.com,+1-315-511-5523x1845,1958-06-04,51218 Victory Blvd,New York,NY,82182-7625,Brooklyn,Email,"Eat sense quite machine. Happen two a notice whom issue.
Note alone establish politics for together. Throw teach mission school.",Corporate
Emily Long,emily.long@example.com,919-336-0993x98965,1983-10-29,57725 Lexington Ave,New York,NY,13517-3640,Brooklyn,Email,"Participant for generation resource rich. West quite dark people certain.
Thing week film figure build. Only marriage everyone relate drug vote various unit. Sure figure stage worry.",Non-Profit
Harper Ross,harper.ross@example.com,475-641-9410,1962-12-15,88298 Fordham Road,New York,NY,68459-9955,Brooklyn,Mail,Study form writer whatever she. Cold outside glass probably others eye race law. Yourself own young environmental government. Want thus mission stand best discover man wife.,Individual
Samuel Torres,samuel.torres@example.com,001-201-511-8905,1991-07-27,292 3rd Ave,New York,NY,39912-4893,Staten Island,Mail,"Fill rest yes each. Drop top note say deal.
Tree else knowledge Mr sort reason. Safe politics suggest sense green. Computer sea show someone author.",VIP
Jonathan Jenkins,jonathan.jenkins@example.com,767-452-4510x8642,1992-07-13,264 West End Ave,New York,NY,32883-5334,Bronx,Email,"Then break leader. Within drive note thought writer property about grow. Campaign oil authority situation.
Speak what plant memory reduce his. Clear reason or market term conference.",Individual
Brandon Wood,brandon.wood@example.com,001-625-620-9948x334,1983-09-22,5456 Fulton Street,New York,NY,10000-1480,Bronx,Phone,"Head hard build themselves adult decision response voice. Remain local central term inside.
Affect know recent. Break build third long.
Lot art customer parent. Country involve have too of recognize.",Individual
Evan Torres,evan.torres@example.com,001-702-759-7894x097,1989-10-17,53015 3rd Ave,New York,NY,42234-2049,Manhattan,Mail,"Development TV campaign indicate since consumer Republican. Customer stage TV spend lot.
Loss painting site her rate think admit. Economic find myself low dream. Success left situation bag.",Corporate
Charlotte Evans,charlotte.evans@example.com,933.229.9255,2003-06-22,35347 Wall Street,New York,NY,64404-6582,Bronx,Mail,"Push feeling him as evening. Wide manage firm hand finally near decision.
Thought respond field artist out second American.",VIP
Kevin King,kevin.king@example.com,418-488-7910x13566,1996-04-22,451 Bleecker Street,New York,NY,14381-4845,Queens,Phone,"Agency task financial important. Product why all fall bit same. Operation onto system between central speak.
Seat edge project toward rule media. Scene attention job road wonder.",Individual
Chloe Simmons,chloe.simmons@example.com,502-963-9313x937,1959-01-02,948 Madison Ave,New York,NY,74512-7692,Brooklyn,Email,Establish five attack share forget husband situation. Wrong reality hotel. Same task suddenly him out recent responsibility.,Corporate
Connor Howard,connor.howard@example.com,377-963-1602x85789,1992-02-18,276 2nd Ave,New York,NY,78217-1795,Staten Island,Mail,"Rock dark foreign business interview. Figure contain president fish break dinner.
Thousand nothing go blood. Lawyer allow fall. Not security clear hold trouble.",Non-Profit
Dylan Wright,dylan.wright@example.com,+1-408-761-6018,2002-01-08,54555 Victory Blvd,New York,NY,61861-9420,Brooklyn,Mail,"Outside down memory stock. Hot position whatever none group southern office voice. Walk course involve daughter.
Word tough thousand. Next claim itself. Life animal fill fire like radio evening.",Corporate
Zoey Campbell,zoey.campbell@example.com,858.859.7854x564,1987-02-03,47959 West End Ave,New York,NY,62792-3061,Staten Island,Email,"Pattern under few cell boy. Contain new pretty answer.
Most exactly health believe expert. Account camera key office have.",Small Business
Michelle Jones,michelle.jones@example.com,001-871-815-2794x33360,1955-12-02,5129 Broadway,New York,NY,80517-4535,Brooklyn,Email,"Own likely left explain rock down Republican not. Produce under heavy child a leg measure.
Exactly follow open. Look keep feeling consider listen.",Non-Profit
Crystal Carter,crystal.carter@example.com,451.845.2255x389,1960-04-16,95400 Fordham Road,New York,NY,76015-6500,Brooklyn,Mail,"Our guy politics. Learn music exist mind television body defense who. Gun information reduce what hospital out order.
Black mother should ball why.",Non-Profit
Jessica Rodriguez,jessica.rodriguez@example.com,(564)201-4970x472,1979-10-08,19328 5th Ave,New York,NY,37776-6690,Staten Island,Mail,Almost bill government member response plan. Information lose central. Once from up through here human anything.,Government
Isaac Murphy,isaac.murphy@example.com,(632)235-9700x369,2004-05-25,52938 Jerome Ave,New York,NY,13314-8831,Manhattan,Email,"Reveal small significant. Serious task sound laugh opportunity act.
Including voice which defense young one. Window recognize set newspaper all civil.",VIP
Zoey Garcia,zoey.garcia@example.com,(498)791-7190x4110,1991-09-06,9913 Astoria Blvd,New York,NY,57438-8818,Bronx,Phone,Image let less religious offer quality. Challenge bar region player beautiful. Indeed guess she hear far. Myself catch hard reduce push lead.,VIP
Hannah Russell,hannah.russell@example.com,(605)369-8176x96346,1978-03-03,278 5th Ave,New York,NY,45645-8613,Brooklyn,Phone,"Same material our beat maintain probably. Step film too.
Know believe business nice type company try. Rate doctor however car analysis.
Check soon type daughter figure commercial.",Non-Profit
Laura Ward,laura.ward@example.com,398.767.0027,1961-10-07,3971 West End Ave,New York,NY,41284-7592,Staten Island,Email,"Ball end allow Mr imagine his. Line public especially lay information argue.
Actually along own which area. Wife very interest ago no leg study speak.",Government
Penelope Adams,penelope.adams@example.com,774.369.6691,1944-05-29,2753 Madison Ave,New York,NY,30431-7338,Staten Island,Phone,"Simply suggest four cup financial yeah. Place physical service everybody.
Down ten under result about down. Responsibility significant attack machine of.
Place leader movie popular final.",Individual
Sarah Bennett,sarah.bennett@example.com,(761)405-4174,1984-05-11,00947 3rd Ave,New York,NY,36939-8207,Bronx,Mail,Life how girl research already fund. Product cell weight fine whether beat tree career. Store interesting stop skin join.,Corporate
Jessica Cook,jessica.cook@example.com,319-952-3232x3702,1983-05-30,82388 Madison Ave,New York,NY,49345-3674,Staten Island,Phone,"Thing various often. Tough only for treatment area five oil.
Computer choose somebody church chance second per page. So benefit move.",VIP
Joseph Davis,joseph.davis@example.com,500.274.2432x6634,1947-11-29,45532 4th Ave,New York,NY,26735-2343,Queens,Mail,Prevent final page piece magazine teach daughter. Use party figure lay trade even poor. Herself worker newspaper think try source.,Non-Profit
Jane Hill,jane.hill@example.com,001-798-249-2618x307,2005-01-25,399 Astoria Blvd,New York,NY,79267-4377,Brooklyn,Mail,"Week few cover week bring long.
Administration find lawyer begin chance. Share the have shoulder discussion feel environment.",Corporate
Lillian Moore,lillian.moore@example.com,324.785.9008x8049,1984-12-14,53613 Northern Blvd,New York,NY,55876-4124,Brooklyn,Phone,Best building report start safe cold that. Event whether news happen perhaps discussion give gas. Every lead series crime.,VIP
Jordan Wright,jordan.wright@example.com,(410)852-6660,2001-06-18,05691 Victory Blvd,New York,NY,10877-8176,Queens,Email,"Know it teach interview. Modern compare moment. Week white radio sell range face.
Recently seven week real discuss relate actually.",VIP
Scarlett Walker,scarlett.walker@example.com,423.536.7355,1975-02-09,294 4th Ave,New York,NY,39892-1741,Bronx,Mail,Produce certain support glass per fine send. Action this tough name often outside safe. Bit claim street everyone bill almost.,Corporate
Harper Howard,harper.howard@example.com,(903)803-0445,1944-03-26,059 Victory Blvd,New York,NY,35740-6316,Bronx,Phone,Born turn recently fund. Social friend course ability so large book. Window majority get activity total add just very.,Small Business
Heather Jenkins,heather.jenkins@example.com,(907)609-8415x7047,1959-07-10,4559 Amsterdam Ave,New York,NY,36691-5329,Queens,Email,"Attention former wife general. Beyond size mention last risk oil.
Peace must per hit religious rise head. At left beautiful community sound left themselves.",Corporate
Alexander Collins,alexander.collins@example.com,+1-741-842-7304,1951-05-05,12545 Lexington Ave,New York,NY,34249-1997,Manhattan,Mail,"Class financial before personal amount stock game. Address news in father though.
Quite become technology sea contain put what. Sort them seek American.",Corporate
Lauren Turner,lauren.turner@example.com,+1-924-377-9611,1975-12-13,9068 Fordham Road,New York,NY,14298-5983,Queens,Mail,Growth suddenly stock individual. Full rather community guy. Country cell huge season.,Small Business
Jack Williams,jack.williams@example.com,(719)866-7502x97481,1952-05-18,37754 Steinway Street,New York,NY,90781-9828,Manhattan,Mail,"List expert skill have. Recognize day herself eye. Information use throw name million.
Film yeah of newspaper. Blue prove difficult management treatment break scene. Child stop will create feel hit.",Individual
Evelyn Gonzales,evelyn.gonzales@example.com,+1-528-700-0773x57537,2002-03-23,655 1st Ave,New York,NY,81825-9878,Manhattan,Phone,Agent believe high manager use. Ability help between rock film moment.,Corporate
Matthew Adams,matthew.adams@example.com,784.898.4230x482,1950-08-31,99408 Richmond Ave,New York,NY,88621-6901,Manhattan,Mail,Physical lay society television nice despite executive. Sell court learn report how clearly. Attention market those thank national tough wear.,Government
Robert Henderson,robert.henderson@example.com,395-409-9456x33193,1965-03-01,35602 Richmond Ave,New York,NY,15210-7924,Bronx,Email,"Become customer vote. Century garden remember doctor want allow.
Other eye visit find. Nation situation chance lose strategy.
Draw certain statement. Lay could since have defense social.",Individual
Harper Butler,harper.butler@example.com,+1-876-921-8144x5535,1983-05-02,32217 Bleecker Street,New York,NY,96908-3841,Staten Island,Phone,"Father view avoid. Religious wall least specific system. Seven put garden bring chair great.
Month even where finally. Cold single talk project gun career save.",VIP
Zoey Roberts,zoey.roberts@example.com,353-730-7924x68481,1969-06-06,28729 Steinway Street,New York,NY,10008-4848,Brooklyn,Mail,Respond should anyone. Accept black society southern lawyer condition model fast. Their contain easy so particularly much clear.,Small Business
Elijah Smith,elijah.smith@example.com,001-770-598-1027x5537,1976-05-31,3896 Northern Blvd,New York,NY,86207-1200,Brooklyn,Mail,Man yet drive certain despite impact apply throw. Event high adult common central. Issue anyone goal job without book maybe.,VIP
Anthony Flores,anthony.flores@example.com,284.545.8761,1978-02-13,07399 5th Ave,New York,NY,34991-3250,Bronx,Phone,"Various new week them. Worry include business seem any such example.
Team court situation your. Network media box free. Can allow action. National job card.",Non-Profit
Jackson Ward,jackson.ward@example.com,+1-678-709-5768x0672,1948-09-06,87856 Wall Street,New York,NY,34041-1083,Queens,Email,Why herself everything material outside. Determine issue experience step. Race six against stock throughout finish yeah idea.,Individual
Joseph Mitchell,joseph.mitchell@example.com,+1-203-936-5512x5939,1989-03-23,9764 Hylan Blvd,New York,NY,89107-1645,Brooklyn,Email,"Same and represent I. Five other like week look inside nice.
Word style life become chance.
Far finish side smile. Many mission population almost movie end.",Individual
Andrew Gray,andrew.gray@example.com,(220)299-9153,1998-05-01,81188 Wall Street,New York,NY,67426-1500,Staten Island,Mail,Month reduce fast different system soon remember above. His image fast idea together. Word artist security chair scene.,Government
Michael Martinez,michael.martinez@example.com,380.242.6466x510,1988-01-28,427 Bowery,New York,NY,96517-9626,Queens,Email,"Pay hotel surface building. Herself just picture.
Cup success mission message material keep wide. Local glass final administration including authority.",Corporate
Cameron Coleman,cameron.coleman@example.com,737.919.8296x52414,1979-04-09,759 Queens Blvd,New York,NY,42722-7220,Staten Island,Mail,"Edge technology or true. Notice rich realize close.
Against have case before. Parent water yeah wife make such debate.",VIP
Gabriel Garcia,gabriel.garcia@example.com,564-421-6610x4950,1960-01-03,9009 Fordham Road,New York,NY,97584-4494,Manhattan,Mail,"Media note prevent build age song store pressure. Somebody clearly physical father through.
Stage society phone. Upon to put east usually much sit.",Individual
Evelyn Butler,evelyn.butler@example.com,9262477916,1990-05-15,25595 Park Ave,New York,NY,43737-6433,Brooklyn,Mail,Unit style training. Discuss financial democratic every old. Miss population where staff.,Small Business
Mia Lopez,mia.lopez@example.com,(521)259-6297,1980-06-14,96651 Bowery,New York,NY,81697-7555,Brooklyn,Email,"Old goal reveal beat three sing middle.
Find decision occur hundred enter team. Game several chair agree a.
Four reach never. Race politics staff skill figure should.",Corporate
Brian Wood,brian.wood@example.com,001-829-426-2942,1982-01-28,042 Canal Street,New York,NY,18464-2065,Staten Island,Mail,"Friend special possible program. Well ball they morning road success produce.
Listen boy parent that information. Add television when large. Without special either knowledge final think.",Government
Rebecca Ward,rebecca.ward@example.com,2606953369,2001-02-08,91218 Columbus Ave,New York,NY,82646-7134,Brooklyn,Mail,Analysis admit forward great there expect. Develop type try note gas federal issue. School enter need maybe lay.,Corporate
Joseph Clark,joseph.clark@example.com,(737)212-1666x86431,1950-11-16,2536 Central Park West,New York,NY,86837-4497,Staten Island,Mail,"Certain part professional soon race machine. Fill remember state recognize large mind.
Call southern some spend town office seven education. Station describe thought education.",Non-Profit
Isaac Simmons,isaac.simmons@example.com,812-565-9968x7174,2004-07-22,92542 Hylan Blvd,New York,NY,63342-5126,Staten Island,Phone,"Degree big their stage involve half. Turn financial property purpose. Player provide explain think administration official product.
Their agree hear film day. Mother although already nation.",Small Business
Aaron King,aaron.king@example.com,(584)511-0869,2000-11-04,612 West End Ave,New York,NY,51845-6601,Manhattan,Phone,"Quickly describe challenge shake.
Before head happen left worker lay during. Consider responsibility financial ball meet. Family activity ever attack.",Non-Profit
Layla Lee,layla.lee@example.com,461-911-6423x2502,1973-01-16,57193 Fulton Street,New York,NY,11193-3867,Staten Island,Mail,"Three well central parent lay tend.
Guy red close close business. Congress leave politics me wife decision traditional.",VIP
Nicole Adams,nicole.adams@example.com,876-454-9632x69882,1993-12-23,590 Fulton Street,New York,NY,23088-2028,Bronx,Email,"Human computer occur east give already. Agree sport more. Management voice power one.
Mrs history leg answer.
Near smile discussion exist radio town kid. Though ever day paper expert way low.",Corporate
Aurora Sanders,aurora.sanders@example.com,(262)969-4835x91827,1951-02-18,99224 Amsterdam Ave,New York,NY,18875-4193,Staten Island,Mail,Small then clearly special. Television will staff reflect consider indeed.,Government
Anthony Martinez,anthony.martinez@example.com,867-406-5001,1945-06-03,15135 Astoria Blvd,New York,NY,99056-4711,Staten Island,Mail,"Long start kind. Training car kitchen school.
Require cost during view significant. Left different late try may relate. Seek evening on degree stock.",Corporate
Chris King,chris.king@example.com,+1-905-996-1693,1952-09-13,32820 Queens Blvd,New York,NY,87048-1292,Brooklyn,Mail,"Summer explain usually class of.
Newspaper agreement owner energy remember.
Office cover son skill camera.
Early language town fire.",Individual
Ellie Martinez,ellie.martinez@example.com,463.522.8717x29765,1996-01-26,00088 Bowery,New York,NY,49765-3180,Manhattan,Email,Something ball teacher person against. Way drug physical check. Worry cover hear enough thousand production. Once adult would question and.,Government
Brittany Thomas,brittany.thomas@example.com,001-897-258-7017,1982-04-25,1450 Bleecker Street,New York,NY,20468-8027,Staten Island,Email,"Over along officer care issue. Response staff hope open show anything. Than action push they around nice.
Price century seem. Weight black yes agent. Rise age wear shoulder decade modern here.",Government
Paisley Cook,paisley.cook@example.com,593.791.3499,1969-11-09,601 Wall Street,New York,NY,85851-7927,Bronx,Email,"Into product arm big both week include this. Teach ball test tend then would else drop.
Tend charge suddenly event. Majority Democrat security though television modern.",Non-Profit
Elijah Hughes,elijah.hughes@example.com,001-346-579-1260x1382,1967-02-02,79270 Astoria Blvd,New York,NY,71548-8234,Manhattan,Email,"Arrive teach authority themselves. Popular simply interview but top human help.
Benefit often campaign. Evening kitchen window without.",Individual
Logan Gonzales,logan.gonzales@example.com,643.754.4892x05939,1959-12-18,430 West End Ave,New York,NY,22625-7235,Bronx,Phone,"Push environmental job. West year more scene trouble recently.
Report woman college career view officer. Start wind later idea ok.
Measure hot material painting information hot foreign.",Small Business
Justin Garcia,justin.garcia@example.com,001-422-593-4105x8961,1999-09-11,04150 Fordham Road,New York,NY,60295-5984,Manhattan,Email,"Reality pass action their.
Describe news good. Than game media mind listen best. Or upon family professional traditional.",Corporate
Elijah Jones,elijah.jones@example.com,581.580.8814,1950-10-09,935 Park Ave,New York,NY,65393-7749,Queens,Phone,Where they entire. Wife give country involve quality trip factor join. Relate lead total now industry friend.,VIP
Justin Cook,justin.cook@example.com,001-294-570-6014x930,1951-02-11,55674 Bowery,New York,NY,18022-6367,Brooklyn,Email,"Body notice pick fine of. Direction dog learn model some glass including.
Marriage suddenly your term toward.",Government
Michelle Foster,michelle.foster@example.com,987-246-5726x505,1967-01-25,6973 Forest Ave,New York,NY,35165-6058,Bronx,Email,"Red apply painting move. Life whom total huge here book. Realize return draw main interview activity. Game pattern simple else.
Oil church avoid. Brother area present black.",Small Business
Scarlett Jones,scarlett.jones@example.com,733-334-1746,1958-05-26,9432 Fordham Road,New York,NY,76927-1221,Brooklyn,Phone,"Industry environment final industry. Toward then your strategy exactly dog.
Step letter newspaper dog cup finally course. Wrong four laugh hotel give yet trade.",Corporate
Lillian Rodriguez,lillian.rodriguez@example.com,+1-848-649-1216x1482,1950-09-06,4741 Victory Blvd,New York,NY,51384-9703,Bronx,Phone,Industry city go with should color its could. Relate evening power. Answer score interest anyone allow.,Corporate
Chloe Murphy,chloe.murphy@example.com,524.983.0166x18921,2004-03-12,7347 Steinway Street,New York,NY,43202-2723,Staten Island,Mail,Enjoy various class Congress partner dream. Professional star cover however fill financial talk. Option condition collection their represent social current can.,Government
Jessica Patterson,jessica.patterson@example.com,885.432.6344x65429,1948-03-08,46812 1st Ave,New York,NY,19179-8273,Queens,Phone,Occur measure power especially book heart. Pull represent sing consumer. Million never from theory Congress thing fast third.,VIP
Addison Howard,addison.howard@example.com,7646262116,1952-07-07,49307 Park Ave,New York,NY,65469-2204,Staten Island,Mail,Activity everything else week produce everything education debate. By difficult also TV officer pay total. Act sort our.,Non-Profit
Melissa Williams,melissa.williams@example.com,+1-257-366-9246,1952-06-06,710 Mulberry Street,New York,NY,46043-2305,Queens,Mail,"Politics view around get never pattern. Exist rock system yourself. Our picture water work music across.
Quickly service region. Race wind would analysis stop.",Individual
John Allen,john.allen@example.com,652.375.6648x24906,1999-04-24,3007 2nd Ave,New York,NY,63301-5274,Queens,Phone,"Set career senior remain task possible sure this. Public baby four final special article.
Seat like federal data among interesting. Morning natural cause. Prepare hair time together use nor need.",Corporate
Michelle Gray,michelle.gray@example.com,(531)552-0305x04453,1970-06-11,226 Arthur Ave,New York,NY,52877-6232,Manhattan,Email,"Contain little police spring bit. Including long population dinner already. Time art smile world feel.
Theory what many hope raise. Simple school attack feeling.",Individual
John Gray,john.gray@example.com,261.476.1133x297,1957-10-21,28845 Bleecker Street,New York,NY,45103-2077,Manhattan,Mail,"Miss leg from case cup explain dark. Month like place into very language ready. Structure production effect yeah sit upon picture.
Everybody and term interest.",Individual
Chloe Wood,chloe.wood@example.com,811.200.4759x66921,1967-09-11,0089 5th Ave,New York,NY,46106-8645,Queens,Email,Early story possible word stop leader. Story tell page section entire major. Five feel factor suffer fish just administration. Watch which at crime consider half practice.,VIP
