name,email,phone_number,date_of_birth,address,city,state,zipcode,neighborhood,preferred_contact_method,notes,client_type
Emma Phillips,emma.phillips@example.com,467-689-5678x94225,1953-07-02,18167 3rd Ave,New York,NY,41896-7468,Manhattan,Phone,"Teach want peace computer dream last long. Direction miss fall practice store activity here.
Hotel politics where experience. Give end it about already pressure.",Small Business
Grace Ward,grace.ward@example.com,001-563-736-8023x24578,1958-09-25,127 1st Ave,New York,NY,76791-6877,Bronx,Phone,Visit organization issue wonder shoulder. Should maintain value from meeting through. Writer friend pressure spring building central leg. Dream something cold bill.,Individual
Scarlett Bell,scarlett.bell@example.com,+1-638-437-5456x7504,1984-10-17,754 Madison Ave,New York,NY,49259-4714,Brooklyn,Email,"Remember where police almost. Somebody right soldier best.
Goal summer news everyone. Real assume left control allow away work security.",Individual
Daniel Smith,daniel.smith@example.com,001-279-666-4387x04393,1964-09-14,01475 Mulberry Street,New York,NY,84734-2872,Queens,Email,"Kid within within.
Thought price soldier live ready woman. Us recently actually discussion. Model interest little body politics home. Grow mention voice.",Small Business
Logan Lewis,logan.lewis@example.com,(833)568-1935x566,1975-08-08,3652 Astoria Blvd,New York,NY,78886-7149,Brooklyn,Phone,"Bank vote whether station executive entire. Cultural admit coach. Exactly clearly region tax.
Media offer into four ok guy must. Window person positive soon executive.",Individual
Ashley Washington,ashley.washington@example.com,823.219.5363x336,1993-12-10,8127 Mulberry Street,New York,NY,75475-1291,Brooklyn,Phone,Else draw car. Might people standard a actually professor gun simply. Check report speech head data financial toward.,Government
Cameron Henderson,cameron.henderson@example.com,627.748.7455x9941,1982-09-11,06614 West End Ave,New York,NY,97935-2729,Manhattan,Mail,"Situation for too guess according worry. Question type easy. Evidence value worry various.
Sign agency computer factor help. Friend so grow guy sell protect. Together relate production.",VIP
Ryan Davis,ryan.davis@example.com,001-995-898-0082x904,1989-03-28,148 1st Ave,New York,NY,46483-8118,Manhattan,Phone,Section director early with foreign. Exist suggest win real north article bank. Condition help central might million.,Small Business
Logan Alexander,logan.alexander@example.com,+1-240-649-9318x50455,1967-12-10,4408 Lexington Ave,New York,NY,14459-8379,Staten Island,Phone,Me tell return method. Hold significant have sing grow bag.,Individual
Caleb Scott,caleb.scott@example.com,001-739-779-8158,1997-08-24,5860 Richmond Ave,New York,NY,35603-4650,Brooklyn,Phone,"Health ok argue high player. Major finally majority tax maintain. Campaign herself ago race stay fine.
Run try article before. This specific power very let.",Individual
Chris Ramirez,chris.ramirez@example.com,+1-424-781-8564x1418,1955-03-28,20847 Astoria Blvd,New York,NY,86329-8808,Brooklyn,Phone,Make something difference. Bar movement hold family range you address.,Individual
Mia Gonzales,mia.gonzales@example.com,8145497582,1970-06-10,70101 Bowery,New York,NY,80545-8949,Queens,Phone,"Middle address yes more lawyer. Watch training sort land wear.
Much husband section Mr minute ask south. Anything worker mission rich site.",VIP
Mason Watson,mason.watson@example.com,9708730184,1965-01-11,4874 Jerome Ave,New York,NY,67322-3822,Brooklyn,Phone,"Stay ever chair among unit. Rest page above character.
Team believe against second price price. Must child fact number pressure idea. Base early job provide expert sit perhaps.",Individual
Eric Edwards,eric.edwards@example.com,+1-849-878-3489x0262,1946-03-02,9768 Fulton Street,New York,NY,28984-9825,Manhattan,Mail,Activity rest thought rule ever doctor. Network order whatever former seem agency blood treatment. Perhaps all large level turn beat.,Corporate
Lucas King,lucas.king@example.com,001-379-800-2979x220,1946-11-23,9146 Columbus Ave,New York,NY,62547-5015,Bronx,Email,"Officer laugh see beyond. Example dinner size baby. Manage eye least end capital.
Current start political hand head affect. Really nearly once why once federal. From read group close building.",Government
Dylan Martin,dylan.martin@example.com,4159051597,1970-04-12,358 Astoria Blvd,New York,NY,56940-2579,Queens,Email,"Worry hope analysis look drop personal store American. Try owner relationship write treatment enter economic.
Race that participant machine near evening hot.",Small Business
Adam Wright,adam.wright@example.com,+1-946-806-8034x914,1984-12-15,2290 Fulton Street,New York,NY,36790-8395,Queens,Email,"Use find community contain. Side reduce trip rise.
Data professional return eat hold agreement no. Owner seat personal during country order later.",Corporate
